name,category,address,group,latitude,longitude,opening_hours
エクセルシオール カフェ 渋谷道玄坂店,cafe,〒150-0043 東京都渋谷区道玄坂２丁目６−１ 岩崎ビル,エクセルシオール,35.659228,139.699095,
＃802 CAFE&DINER 渋谷店,cafe,〒150-0042 東京都渋谷区宇田川町２８−３ いちご渋谷文化村通りビル8階,,35.660192,139.698296,
Cafe x Lounge MICROCOSMOS,cafe,〒150-0002 東京都渋谷区渋谷１丁目２５−６ 渋谷パークサイド共同ビル 8F,,35.659687,139.701488,ageage
WORK COURT渋谷松濤コワーキング シェアオフィス,coworking,〒150-0046 東京都渋谷区松濤１丁目２８−２,,35.659878,139.694841,
シェアオフィス コワーキングスペース Laugh Out(ラフアウト) 渋谷,coworking,〒150-0041 東京都渋谷区神南１丁目７−７ 渋谷公園通りNnビル 渋谷公園通り,,35.659878,139.699208,hogehoge